{
  "$schema": "https://json-schema.org/draft/2020-12/schema",
  "$id": "https://pocketjs.dev/schema/pocket-environment-1.json",
  "title": "Pocket environment, format 1",
  "type": "object",
  "additionalProperties": false,
  "required": [
    "$schema",
    "pocketEnvironment",
    "id",
    "name",
    "title",
    "version",
    "runtime",
    "applications"
  ],
  "properties": {
    "$schema": {
      "const": "https://pocketjs.dev/schema/pocket-environment-1.json"
    },
    "pocketEnvironment": {
      "const": 1
    },
    "id": {
      "type": "string",
      "minLength": 3,
      "pattern": "^[a-z0-9](?:[a-z0-9-]*[a-z0-9])?(?:\\.[a-z0-9](?:[a-z0-9-]*[a-z0-9])?)+$"
    },
    "name": {
      "type": "string",
      "minLength": 1,
      "maxLength": 64,
      "pattern": "^[a-z][a-z0-9]*(?:-[a-z0-9]+)*$"
    },
    "title": {
      "type": "string",
      "minLength": 1,
      "maxLength": 128
    },
    "version": {
      "type": "string",
      "pattern": "^(0|[1-9][0-9]*)\\.(0|[1-9][0-9]*)\\.(0|[1-9][0-9]*)(?:-[0-9A-Za-z-]+(?:\\.[0-9A-Za-z-]+)*)?(?:\\+[0-9A-Za-z-]+(?:\\.[0-9A-Za-z-]+)*)?$"
    },
    "runtime": {
      "type": "object",
      "additionalProperties": false,
      "required": [
        "supervisor"
      ],
      "properties": {
        "supervisor": {
          "type": "object",
          "additionalProperties": false,
          "required": [
            "shell",
            "background"
          ],
          "properties": {
            "shell": {
              "type": "string",
              "minLength": 3,
              "pattern": "^[a-z0-9](?:[a-z0-9-]*[a-z0-9])?(?:\\.[a-z0-9](?:[a-z0-9-]*[a-z0-9])?)+$"
            },
            "background": {
              "enum": [
                "visible",
                "resident"
              ]
            }
          }
        }
      }
    },
    "applications": {
      "type": "object",
      "additionalProperties": false,
      "required": [
        "model",
        "mutable",
        "packages"
      ],
      "properties": {
        "model": {
          "const": "managed"
        },
        "mutable": {
          "type": "boolean"
        },
        "packages": {
          "type": "array",
          "minItems": 1,
          "items": {
            "type": "object",
            "additionalProperties": false,
            "required": [
              "package",
              "manifest",
              "installation"
            ],
            "properties": {
              "package": {
                "type": "string",
                "minLength": 3,
                "pattern": "^[a-z0-9](?:[a-z0-9-]*[a-z0-9])?(?:\\.[a-z0-9](?:[a-z0-9-]*[a-z0-9])?)+$"
              },
              "manifest": {
                "type": "string",
                "minLength": 1,
                "pattern": "^(?!/)(?!.*(?:^|/)\\.\\.(?:/|$))(?!.*\\\\).+\\.json$"
              },
              "installation": {
                "enum": [
                  "required",
                  "installed",
                  "available"
                ]
              },
              "presentation": {
                "type": "object",
                "additionalProperties": false,
                "required": [
                  "title",
                  "viewport"
                ],
                "properties": {
                  "title": {
                    "type": "string",
                    "minLength": 1,
                    "maxLength": 128
                  },
                  "viewport": {
                    "type": "array",
                    "items": {
                      "type": "integer",
                      "minimum": 1
                    },
                    "minItems": 2,
                    "maxItems": 2
                  }
                }
              }
            }
          }
        }
      }
    }
  }
}
